{
  "version": "1.0",
  "description": "Centralized validation rules for Lexicographic Curation Workbench",
  "rules": {
    "R1.1.1": {
      "name": "entry_id_required",
      "description": "Entry ID is required and must be non-empty",
      "category": "entry_level",
      "priority": "critical",
      "path": "$.id",
      "condition": "required",
      "validation": {
        "type": "string",
        "minLength": 1
      },
      "error_message": "Entry ID is required and must be non-empty",
      "client_side": true
    },
    "R1.1.2": {
      "name": "lexical_unit_required",
      "description": "Lexical unit is required and must contain at least one language entry",
      "category": "entry_level",
      "priority": "critical",
      "path": "$.lexical_unit",
      "condition": "required",
      "validation": {
        "type": "object",
        "minProperties": 1
      },
      "error_message": "Lexical unit is required and must contain at least one language entry",
      "client_side": true
    },
    "R1.2.2": {
      "name": "lexical_unit_content_validation",
      "description": "Lexical unit content must be non-empty strings",
      "category": "entry_level",
      "priority": "critical",
      "path": "$.lexical_unit.*",
      "condition": "if_present",
      "validation": {
        "type": "string",
        "minLength": 1,
        "pattern": "\\S+"
      },
      "error_message": "Lexical unit content cannot be empty or contain only whitespace",
      "client_side": true
    },
    "R1.1.3": {
      "name": "sense_required",
      "description": "At least one sense is required per entry (except for variant entries)",
      "category": "entry_level",
      "priority": "critical",
      "path": "$.senses",
      "condition": "custom",
      "validation": {
        "custom_function": "validate_sense_required_non_variant"
      },
      "error_message": "At least one sense is required per entry",
      "client_side": true,
      "validation_mode": "save_only"
    },
    "R1.2.1": {
      "name": "entry_id_format",
      "description": "Entry ID must match valid format pattern",
      "category": "entry_level",
      "priority": "critical",
      "path": "$.id",
      "condition": "if_present",
      "validation": {
        "type": "string",
        "pattern": "^[a-zA-Z0-9_\\- ]+$"
      },
      "error_message": "Invalid entry ID format. Use only letters, numbers, underscores, hyphens, and spaces",
      "client_side": true
    },
    "R1.2.3": {
      "name": "language_code_format_validation",
      "description": "Language codes must follow RFC 4646 format",
      "category": "entry_level",
      "priority": "warning",
      "path": "$.lexical_unit",
      "condition": "custom",
      "validation": {
        "custom_function": "validate_language_code_format"
      },
      "error_message": "Invalid language code format: {value}. Must follow RFC 4646 (e.g., 'en', 'pl', 'seh-fonipa')",
      "client_side": true
    },
    "R2.1.1": {
      "name": "sense_id_required",
      "description": "Sense ID is required and must be non-empty",
      "category": "sense_level",
      "priority": "critical",
      "path": "$.senses[*].id",
      "condition": "required",
      "validation": {
        "type": "string",
        "minLength": 1
      },
      "error_message": "Sense ID is required and must be non-empty",
      "client_side": true
    },
    "R2.1.2": {
      "name": "sense_content_or_variant",
      "description": "Sense definition OR gloss is required (except for variant senses)",
      "category": "sense_level",
      "priority": "critical",
      "path": "$.senses[*]",
      "condition": "custom",
      "validation": {
        "custom_function": "validate_sense_content_or_variant"
      },
      "error_message": "Sense must have definition, gloss, or be a variant reference",
      "client_side": true
    },
    "R2.2.1": {
      "name": "definition_content_validation",
      "description": "Sense definitions must be non-empty strings when provided (source language definitions can be empty)",
      "category": "sense_level",
      "priority": "critical",
      "path": "$.senses[*]",
      "condition": "custom",
      "validation": {
        "custom_function": "validate_definition_content_source_lang_exception"
      },
      "error_message": "Sense definition cannot be empty or contain only whitespace",
      "client_side": true
    },
    "R2.2.2": {
      "name": "gloss_content_validation",
      "description": "Sense glosses must be non-empty strings when provided",
      "category": "sense_level",
      "priority": "critical",
      "path": "$.senses[*].gloss.*.text",
      "condition": "if_present",
      "validation": {
        "type": "string",
        "minLength": 1,
        "pattern": "\\S+"
      },
      "error_message": "Sense gloss cannot be empty or contain only whitespace",
      "client_side": true
    },
    "R2.2.3": {
      "name": "example_text_validation",
      "description": "Example texts must be non-empty when example is present",
      "category": "sense_level",
      "priority": "critical",
      "path": "$.senses[*].examples[*].text",
      "condition": "if_present",
      "validation": {
        "type": "string",
        "minLength": 1,
        "pattern": "\\S+"
      },
      "error_message": "Example text cannot be empty or contain only whitespace",
      "client_side": true
    },
    "R3.1.1": {
      "name": "unique_note_types",
      "description": "Note types must be unique per entry",
      "category": "note_validation",
      "priority": "warning",
      "path": "$.notes",
      "condition": "if_present",
      "validation": {
        "custom_function": "validate_unique_note_types"
      },
      "error_message": "Duplicate note type found. Each note type can appear only once per entry",
      "client_side": true
    },
    "R3.1.2": {
      "name": "note_content_validation",
      "description": "Note content must be non-empty when note type is specified",
      "category": "note_validation",
      "priority": "critical",
      "path": "$.notes",
      "condition": "custom",
      "validation": {
        "custom_function": "validate_note_content"
      },
      "error_message": "Note content cannot be empty for specified type",
      "client_side": true
    },
    "R3.1.3": {
      "name": "multilingual_note_structure",
      "description": "Multilingual notes must follow proper language code structure",
      "category": "note_validation",
      "priority": "warning",
      "path": "$.notes",
      "condition": "custom",
      "validation": {
        "custom_function": "validate_multilingual_note_structure"
      },
      "error_message": "Multilingual note has invalid language code structure",
      "client_side": true
    },
    "R4.1.1": {
      "name": "pronunciation_language_restriction",
      "description": "Pronunciation language must be seh-fonipa",
      "category": "pronunciation",
      "priority": "critical",
      "path": "$.pronunciations",
      "condition": "custom",
      "validation": {
        "custom_function": "validate_pronunciation_language_codes",
        "allowed_languages": ["seh-fonipa"]
      },
      "error_message": "Pronunciation language must be 'seh-fonipa', got '{value}'",
      "client_side": true
    },
    "R4.1.2": {
      "name": "ipa_character_validation",
      "description": "IPA characters must be from approved character set",
      "category": "pronunciation",
      "priority": "critical",
      "path": "$.pronunciations['seh-fonipa']",
      "condition": "if_present",
      "validation": {
        "type": "string",
        "pattern": "^[ɑæɒəɜɪiʊuʌeɛoɔabdfhjklmnprstwvzðθŋʃʒɡːˈˌᵻ (),.]+$"
      },
      "error_message": "Invalid IPA characters in pronunciation. Only approved IPA characters are allowed",
      "client_side": true
    },
    "R4.2.1": {
      "name": "no_double_stress_markers",
      "description": "No double stress markers allowed",
      "category": "pronunciation",
      "priority": "critical",
      "path": "$.pronunciations['seh-fonipa']",
      "condition": "if_present",
      "validation": {
        "type": "string",
        "not_pattern": "(ˈˈ|ˌˌ|ˈˌ|ˌˈ)"
      },
      "error_message": "Double stress markers not allowed in IPA pronunciation",
      "client_side": true
    },
    "R4.2.2": {
      "name": "no_double_length_markers",
      "description": "No double length markers allowed",
      "category": "pronunciation",
      "priority": "critical",
      "path": "$.pronunciations['seh-fonipa']",
      "condition": "if_present",
      "validation": {
        "type": "string",
        "not_pattern": "ːː"
      },
      "error_message": "Double length markers not allowed in IPA pronunciation",
      "client_side": true
    },
    "R8.1.1": {
      "name": "media_file_validation",
      "description": "Media file references must point to existing files",
      "category": "resource_validation",
      "priority": "critical",
      "path": "$.pronunciations.media[*].href",
      "condition": "if_present",
      "validation": {
        "custom_function": "validate_file_exists"
      },
      "error_message": "Media file not found: {value}",
      "client_side": false,
      "server_side": true
    },
    "R8.1.2": {
      "name": "illustration_file_validation",
      "description": "Illustration file references must point to existing files",
      "category": "resource_validation",
      "priority": "critical",
      "path": "$.senses[*].illustrations[*].href",
      "condition": "if_present",
      "validation": {
        "custom_function": "validate_file_exists"
      },
      "error_message": "Illustration file not found: {value}",
      "client_side": false,
      "server_side": true
    },
    "R6.1.1": {
      "name": "entry_sense_pos_consistency",
      "description": "If entry has POS and senses have POS, they must be consistent",
      "category": "hierarchical_validation",